{
  "$schema": "../../schemas/slide-content.schema.json",
  "template": "title-slide",
  "deck": "WattZap — Universal Company Introduction",
  "slideNumber": 1,
  "totalSlides": 14,
  "sectionLabel": "Company Introduction",
  "title": "Industrial electricity costs, turned into measured savings",
  "titleAccent": "measured savings",
  "subtitle": "We help businesses diagnose, protect, optimise, generate, finance and prove energy savings",
  "supporting": "WattZap Energy Solutions is an industrial energy-savings and optimisation company for Indian industrial and commercial customers — starting with rice mills and energy-intensive SMEs.",
  "footerNote": "WattZap Energy Solutions — Confidential",
  "a11yLabel": "Opening slide: WattZap turns industrial electricity costs into measured savings — measured savings, not equipment sales.",
  "content": {
    "kicker": "Measured savings, not equipment sales",
    "highlights": [
      "Industrial and commercial focus",
      "One structured end-to-end journey",
      "Outcomes measured, not promised"
    ],
    "dateLine": "WattZap Energy Solutions · Naveen Badarla, Founder · 2026"
  }
}
