{
  "$schema": "../../schemas/slide-content.schema.json",
  "template": "three-column-overview",
  "deck": "WattZap — Universal Company Introduction",
  "slideNumber": 4,
  "totalSlides": 14,
  "sectionLabel": "The WattZap Difference",
  "title": "WattZap begins with the opportunity, not a product",
  "titleAccent": "opportunity",
  "subtitle": "The intervention follows the evidence",
  "footerNote": "WattZap Energy Solutions — Confidential",
  "a11yLabel": "How WattZap begins differently: understand first, act on evidence, then prove and expand.",
  "content": {
    "columns": [
      {
        "icon": "meter",
        "heading": "Understand first",
        "bullets": [
          "Build the baseline from bills and site data",
          "Identify what is actually driving cost",
          "Separate assumptions from measured opportunities"
        ]
      },
      {
        "icon": "gear",
        "heading": "Act on evidence",
        "bullets": [
          "Prioritise high-confidence actions first",
          "Implement only what is needed",
          "No predetermined product to push"
        ]
      },
      {
        "icon": "chart",
        "heading": "Prove, then expand",
        "bullets": [
          "Measure the actual result against the baseline",
          "Expand only after value is demonstrated",
          "Every step earns the next one"
        ]
      }
    ],
    "outcomes": [
      "Diagnosis before investment; verification after implementation"
    ]
  }
}
