{
  "$schema": "../../schemas/slide-content.schema.json",
  "template": "process-flow",
  "deck": "WattZap — Universal Company Introduction",
  "slideNumber": 8,
  "totalSlides": 14,
  "sectionLabel": "Optimise",
  "title": "Use the existing site more intelligently first",
  "titleAccent": "intelligently",
  "subtitle": "EMS Lite and EMS Pro — monitoring that leads to better decisions",
  "footerNote": "WattZap Energy Solutions — Confidential",
  "a11yLabel": "The optimisation journey: see, understand, decide, act, automate — improving existing operations before adding infrastructure.",
  "content": {
    "steps": [
      {
        "icon": "meter",
        "heading": "See",
        "caption": "Site and machine-level visibility"
      },
      {
        "icon": "chart",
        "heading": "Understand",
        "caption": "Alerts and anomaly detection"
      },
      {
        "icon": "gear",
        "heading": "Decide",
        "caption": "Recommendations and load scheduling"
      },
      {
        "icon": "bolt",
        "heading": "Act",
        "caption": "Peak management and process changes"
      },
      {
        "icon": "signal",
        "heading": "Automate",
        "caption": "Semi-automated and automated control"
      }
    ],
    "outcomes": [
      "Monitoring is only valuable when it changes decisions",
      "Optimise before adding more infrastructure"
    ]
  }
}
