{
  "$schema": "../../schemas/slide-content.schema.json",
  "template": "title-slide",
  "deck": "WattZap × VVDN — Initial Pilot Requirement Brief",
  "slideNumber": 1,
  "totalSlides": 3,
  "sectionLabel": "Partner Brief",
  "title": "WattZap × VVDN",
  "titleAccent": "VVDN",
  "subtitle": "Initial pilot requirement brief for MVP hardware deployment",
  "supporting": "Two pilot sites to prove measured energy savings end to end — a rice mill and an EV charging station — using VVDN-built metering and connectivity hardware.",
  "footerNote": "WattZap Energy Solutions — Confidential",
  "a11yLabel": "Title slide: WattZap and VVDN initial pilot requirement brief for MVP hardware deployment.",
  "content": {
    "kicker": "Initial Pilot Requirement Brief",
    "highlights": [
      "Measured savings, not equipment sales",
      "Two pilot sites: rice mill + EV charging",
      "90-day MVP deployment"
    ],
    "dateLine": "Prepared for VVDN Technologies · July 2026 · Working draft for discussion"
  }
}
