{
  "$schema": "../../schemas/slide-content.schema.json",
  "template": "title-slide",
  "deck": "WattZap — Company Introduction",
  "slideNumber": 1,
  "totalSlides": 9,
  "sectionLabel": "Company Introduction",
  "title": "WattZap Energy Solutions",
  "titleAccent": "Energy Solutions",
  "subtitle": "Measured savings, not equipment sales",
  "supporting": "WattZap takes Indian businesses from a free energy audit to independently verified savings — through one platform, one journey and commercial models that pay from results.",
  "footerNote": "WattZap Energy Solutions — Confidential",
  "a11yLabel": "Title slide: WattZap Energy Solutions company introduction — measured savings, not equipment sales.",
  "content": {
    "kicker": "Energy savings you can verify",
    "highlights": [
      "Free EnergyScan audit as the entry point",
      "Six-stage journey: Diagnose to Prove",
      "Serving Telangana & Andhra Pradesh"
    ],
    "dateLine": "WattZap Energy Solutions · 2026 · Naveen Badarla, Founder"
  }
}
